{
  "$schema": "https://json-schema.org/draft/2020-12/schema",
  "$id": "https://raw.githubusercontent.com/jeremiah-k/medre/main/docs/schemas/canonical-event.schema.json",
  "title": "CanonicalEvent",
  "description": "The universal, immutable event envelope for the MEDRE pipeline. Every event is represented as a CanonicalEvent. Derived from msgspec.Struct with frozen=True.",
  "type": "object",
  "properties": {
    "event_id": {
      "type": "string",
      "minLength": 1,
      "description": "Globally unique, non-empty opaque event identifier. No UUID version or chronological ordering is enforced."
    },
    "event_kind": {
      "type": "string",
      "minLength": 1,
      "description": "Non-empty event kind. Unrecognized kinds can be retained as evidence but are suppressed by capability planning."
    },
    "schema_version": {
      "type": "integer",
      "minimum": 1,
      "description": "Schema version number for the payload structure. Must be >= 1."
    },
    "timestamp": {
      "type": "string",
      "format": "date-time",
      "description": "The moment the event occurred (UTC, timezone-aware ISO-8601)."
    },
    "source_adapter": {
      "type": "string",
      "description": "Name of the adapter that produced the event."
    },
    "source_transport_id": {
      "type": "string",
      "description": "Identifier of the transport that carried the event (native actor/source identity)."
    },
    "source_channel_id": {
      "type": ["string", "null"],
      "description": "Channel/conversation ID at the source, if applicable."
    },
    "parent_event_id": {
      "type": ["string", "null"],
      "description": "ID of the parent event in a derivation chain, if this event was derived from another."
    },
    "lineage": {
      "type": "array",
      "items": {
        "type": "string",
        "minLength": 1
      },
      "description": "Ordered list of event IDs forming the derivation ancestry."
    },
    "relations": {
      "type": "array",
      "items": {
        "$ref": "#/$defs/EventRelation"
      },
      "description": "Typed links to other events (replies, reactions, edits, etc.)."
    },
    "payload": {
      "type": "object",
      "additionalProperties": true,
      "description": "Extensible event-specific JSON object. The envelope does not dispatch per-kind payload validators; individual admission and adapter contracts enforce their own payload rules."
    },
    "metadata": {
      "$ref": "#/$defs/EventMetadata"
    },
    "source_native_ref": {
      "oneOf": [
        {
          "$ref": "#/$defs/NativeRef"
        },
        {
          "type": "null"
        }
      ],
      "description": "Inbound native message reference carried from codec. None for outbound/internal events."
    },
    "depth": {
      "type": "integer",
      "minimum": 0,
      "default": 0,
      "description": "Depth in the derivation tree (0 for source events)."
    },
    "trace_id": {
      "type": ["string", "null"],
      "default": null,
      "description": "Distributed tracing correlation ID."
    },
    "root_event_id": {
      "type": ["string", "null"],
      "default": null,
      "description": "Canonical event ID of the root event in a relation chain. Populated by ConversationGraphAuthority during pipeline ingress."
    },
    "conversation_id": {
      "type": ["string", "null"],
      "default": null,
      "description": "Canonical conversation identifier. Currently equals root_event_id; reserved for future divergence."
    }
  },
  "required": [
    "event_id",
    "event_kind",
    "schema_version",
    "timestamp",
    "source_adapter",
    "source_transport_id",
    "source_channel_id",
    "parent_event_id",
    "lineage",
    "relations",
    "payload",
    "metadata"
  ],
  "additionalProperties": false,
  "$defs": {
    "NativeRef": {
      "title": "NativeRef",
      "description": "Reference to a message in an adapter's native ID space.",
      "type": "object",
      "properties": {
        "adapter": {
          "type": "string",
          "description": "Name of the adapter that owns the native namespace."
        },
        "native_channel_id": {
          "type": ["string", "null"],
          "description": "Channel/conversation ID in the adapter's native format."
        },
        "native_message_id": {
          "type": "string",
          "description": "Message ID in the adapter's native format."
        },
        "native_thread_id": {
          "type": ["string", "null"],
          "default": null,
          "description": "Native thread or parent ID when available; Matrix ingress uses the thread-root event ID."
        }
      },
      "required": ["adapter", "native_channel_id", "native_message_id"],
      "additionalProperties": false
    },
    "EventRelation": {
      "title": "EventRelation",
      "description": "A typed link from one event to another (reply, reaction, edit, delete, thread).",
      "type": "object",
      "properties": {
        "relation_type": {
          "type": "string",
          "enum": ["reply", "reaction", "edit", "delete", "thread"],
          "description": "The kind of relationship."
        },
        "target_event_id": {
          "type": ["string", "null"],
          "description": "The canonical event ID of the target event, if known."
        },
        "target_native_ref": {
          "oneOf": [
            {
              "$ref": "#/$defs/NativeRef"
            },
            {
              "type": "null"
            }
          ],
          "description": "A native-space reference to the target, used when the canonical ID has not been resolved."
        },
        "key": {
          "type": ["string", "null"],
          "description": "Optional discriminator (e.g. the emoji for a reaction relation)."
        },
        "fallback_text": {
          "type": ["string", "null"],
          "description": "Human-readable text carrying the semantic content of this relation when the target adapter's capability level is 'fallback'. Used by the target-native renderer to produce degraded text output within its native format. Not a generic text payload. Not used when capability is 'native' or 'unsupported'."
        },
        "metadata": {
          "type": "object",
          "additionalProperties": true,
          "default": {},
          "description": "Arbitrary key-value metadata attached to this relation."
        },
        "target_fact": {
          "oneOf": [
            {
              "$ref": "#/$defs/RelationTargetFact"
            },
            {
              "type": "null"
            }
          ],
          "default": null,
          "description": "Optional core-computed destination-scoped binding and mutation-eligibility fact. Computed from stored canonical events and NativeMessageRef records only (never wire metadata); exists only on in-flight enriched copies and is never persisted into canonical_events."
        }
      },
      "required": [
        "relation_type",
        "target_event_id",
        "target_native_ref",
        "key",
        "fallback_text"
      ],
      "additionalProperties": false
    },
    "RelationTargetFact": {
      "title": "RelationTargetFact",
      "description": "Core-computed destination-scoped binding + mutation-eligibility fact. Built exclusively by core relation binding from stored canonical events and NativeMessageRef records; user/wire-supplied relation metadata is never an input. Renderers/adapters treat it as the sole authority for native mutation authorization. Never persisted into canonical_events.",
      "type": "object",
      "properties": {
        "status": {
          "type": "string",
          "enum": [
            "bound",
            "bound_owned",
            "unresolved_target",
            "out_of_scope",
            "ambiguous",
            "not_authorized",
            "binding_unavailable"
          ],
          "description": "Resolved destination-scoped binding status. binding_unavailable ALWAYS fails closed; not_authorized is an authorization failure, distinct from the inability-to-bind statuses."
        },
        "adapter": {
          "type": ["string", "null"],
          "default": null,
          "description": "Exact destination adapter instance id the fact was computed for."
        },
        "native_channel_id": {
          "type": ["string", "null"],
          "default": null,
          "description": "Native channel of the bound candidate copy; null when unbound."
        },
        "native_message_id": {
          "type": ["string", "null"],
          "default": null,
          "description": "Native message id of the bound candidate copy; null when unbound."
        },
        "native_thread_id": {
          "type": ["string", "null"],
          "default": null,
          "description": "Native thread id of the bound candidate copy, when applicable."
        },
        "direction": {
          "type": ["string", "null"],
          "enum": ["inbound", "outbound", null],
          "default": null,
          "description": "Direction of the bound candidate; always 'outbound' when status is bound_owned."
        },
        "reason": {
          "type": ["string", "null"],
          "default": null,
          "description": "Stable machine-readable snake_case reason code + context (e.g. 'ambiguous:multiple_distinct_native_targets'); null for clean binds."
        },
        "target_event_kind": {
          "type": ["string", "null"],
          "default": null,
          "description": "Stored canonical EventKind of the binding target, when it was read during binding; renderers use it to reject edits of immutable media originals."
        }
      },
      "required": ["status"],
      "additionalProperties": false
    },
    "EventMetadata": {
      "title": "EventMetadata",
      "description": "Top-level metadata container carried by every canonical event.",
      "type": "object",
      "properties": {
        "transport": {
          "oneOf": [
            {
              "$ref": "#/$defs/TransportMetadata"
            },
            {
              "type": "null"
            }
          ],
          "default": null,
          "description": "Transport-layer metadata."
        },
        "routing": {
          "oneOf": [
            {
              "$ref": "#/$defs/RoutingMetadata"
            },
            {
              "type": "null"
            }
          ],
          "default": null,
          "description": "Routing-layer metadata."
        },
        "radio": {
          "oneOf": [
            {
              "$ref": "#/$defs/RadioMetadata"
            },
            {
              "type": "null"
            }
          ],
          "default": null,
          "description": "RF-layer metadata."
        },
        "telemetry": {
          "oneOf": [
            {
              "$ref": "#/$defs/TelemetryMetadata"
            },
            {
              "type": "null"
            }
          ],
          "default": null,
          "description": "Telemetry metrics namespace."
        },
        "native": {
          "oneOf": [
            {
              "$ref": "#/$defs/NativeMetadata"
            },
            {
              "type": "null"
            }
          ],
          "default": null,
          "description": "Opaque adapter-specific data."
        },
        "custom": {
          "type": "object",
          "additionalProperties": true,
          "default": {},
          "description": "Free-form dictionary for extensions and plugins."
        }
      },
      "additionalProperties": false
    },
    "TransportMetadata": {
      "title": "TransportMetadata",
      "description": "Metadata describing the transport layer that carried the event.",
      "type": "object",
      "properties": {
        "protocol": {
          "type": ["string", "null"],
          "default": null,
          "description": "Transport protocol name (e.g. 'mqtt', 'tcp', 'http')."
        },
        "substrate": {
          "type": ["string", "null"],
          "default": null,
          "description": "Physical/link-layer substrate (e.g. 'lorawan', 'wifi')."
        },
        "gateway_id": {
          "type": ["string", "null"],
          "default": null,
          "description": "Identifier of the gateway node that relayed the event."
        },
        "delivery_method": {
          "type": ["string", "null"],
          "default": null,
          "description": "How the message was delivered (e.g. 'direct', 'store_forward')."
        },
        "delivery_confirmed": {
          "type": ["boolean", "null"],
          "default": null,
          "description": "Whether the transport confirmed successful delivery."
        },
        "transport_encrypted": {
          "type": ["boolean", "null"],
          "default": null,
          "description": "Whether the transport layer provided encryption."
        },
        "signature_valid": {
          "type": ["boolean", "null"],
          "default": null,
          "description": "Whether a digital signature was verified."
        },
        "propagation_state": {
          "type": ["string", "null"],
          "default": null,
          "description": "Current propagation state as a transport-specific string."
        }
      },
      "additionalProperties": false
    },
    "RoutingMetadata": {
      "title": "RoutingMetadata",
      "description": "Metadata produced by the routing subsystem.",
      "type": "object",
      "properties": {
        "matched_routes": {
          "type": "array",
          "items": {
            "type": "string"
          },
          "default": [],
          "description": "List of route identifiers that matched this event."
        },
        "fanout_group": {
          "type": ["string", "null"],
          "default": null,
          "description": "Name of the fanout group, if the event was broadcast."
        },
        "route_trace": {
          "type": "array",
          "items": {
            "type": "string"
          },
          "default": [],
          "description": "Ordered list of route IDs recorded per event delivery."
        }
      },
      "additionalProperties": false
    },
    "RadioMetadata": {
      "title": "RadioMetadata",
      "description": "RF-layer metadata for radio-transport events (e.g. Meshtastic).",
      "type": "object",
      "properties": {
        "snr": {
          "type": ["number", "null"],
          "default": null,
          "description": "Signal-to-noise ratio in dB."
        },
        "rssi": {
          "type": ["number", "null"],
          "default": null,
          "description": "Received signal strength indicator in dBm."
        },
        "channel_index": {
          "type": ["integer", "null"],
          "default": null,
          "description": "Radio channel index used for transmission."
        },
        "frequency": {
          "type": ["number", "null"],
          "default": null,
          "description": "Operating frequency in MHz."
        }
      },
      "additionalProperties": false
    },
    "TelemetryMetadata": {
      "title": "TelemetryMetadata",
      "description": "Arbitrary metrics from telemetry-producing events.",
      "type": "object",
      "properties": {
        "metrics": {
          "type": "object",
          "additionalProperties": {
            "type": ["number", "string", "boolean"]
          },
          "default": {},
          "description": "Flat dictionary of metric names to numeric, string, or boolean values."
        }
      },
      "additionalProperties": false
    },
    "NativeMetadata": {
      "title": "NativeMetadata",
      "description": "Adapter-owned native metadata container for versioned transport and explicit interoperability namespaces.",
      "type": "object",
      "properties": {
        "data": {
          "type": "object",
          "additionalProperties": true,
          "default": {},
          "description": "Versioned built-in transport namespaces plus explicitly specified interoperability namespaces."
        }
      },
      "additionalProperties": false
    }
  }
}
